{
  "schemaVersion": 1,
  "registryVersion": "2026-05-05.descriptor-precision-tools-v1",
  "description": "Explicit UEvolve MCP tool registry. This file is loaded by UnrealMcpToolRegistry before falling back to built-in defaults.",
  "tools": [
    {
      "name": "unreal.batch_configure_static_mesh_actors",
      "category": "actors",
      "handlerName": "unreal.batch_configure_static_mesh_actors",
      "exposure": "visible",
      "riskLevel": "low",
      "requiresWrite": false,
      "requiresBuild": false,
      "requiresExternalProcess": false,
      "requiresRestart": false,
      "requiresProjectMemory": false,
      "requiresLock": false,
      "dryRunSupport": false,
      "preflightSupport": false,
      "postcheckSupport": false,
      "testCoverage": "missing",
      "owner": "UEvolve Core",
      "docsPath": "README.md#tool-coverage",
      "reason": "Explicit registry: actors tool with controlled write or workflow side effects.",
      "notes": ""
    },
    {
      "name": "unreal.batch_set_actor_properties",
      "category": "actors",
      "handlerName": "unreal.batch_set_actor_properties",
      "exposure": "legacy_hidden",
      "riskLevel": "medium",
      "requiresWrite": true,
      "requiresBuild": false,
      "requiresExternalProcess": false,
      "requiresRestart": false,
      "requiresProjectMemory": false,
      "requiresLock": false,
      "dryRunSupport": false,
      "preflightSupport": true,
      "postcheckSupport": true,
      "testCoverage": "missing",
      "owner": "UEvolve Core",
      "docsPath": "README.md#tool-coverage",
      "reason": "Explicit registry: actors tool with controlled write or workflow side effects.",
      "notes": "Legacy flexible property map uses additionalProperties=true; prefer fixed-schema batch actor tools."
    },
    {
      "name": "unreal.batch_set_actor_scale",
      "category": "actors",
      "handlerName": "unreal.batch_set_actor_scale",
      "exposure": "visible",
      "riskLevel": "medium",
      "requiresWrite": true,
      "requiresBuild": false,
      "requiresExternalProcess": false,
      "requiresRestart": false,
      "requiresProjectMemory": false,
      "requiresLock": false,
      "dryRunSupport": false,
      "preflightSupport": true,
      "postcheckSupport": true,
      "testCoverage": "missing",
      "owner": "UEvolve Core",
      "docsPath": "README.md#tool-coverage",
      "reason": "Explicit registry: actors tool with controlled write or workflow side effects.",
      "notes": ""
    },
    {
      "name": "unreal.batch_set_actor_tags",
      "category": "actors",
      "handlerName": "unreal.batch_set_actor_tags",
      "exposure": "visible",
      "riskLevel": "medium",
      "requiresWrite": true,
      "requiresBuild": false,
      "requiresExternalProcess": false,
      "requiresRestart": false,
      "requiresProjectMemory": false,
      "requiresLock": false,
      "dryRunSupport": false,
      "preflightSupport": true,
      "postcheckSupport": true,
      "testCoverage": "missing",
      "owner": "UEvolve Core",
      "docsPath": "README.md#tool-coverage",
      "reason": "Explicit registry: actors tool with controlled write or workflow side effects.",
      "notes": ""
    },
    {
      "name": "unreal.batch_set_point_light_properties",
      "category": "actors",
      "handlerName": "unreal.batch_set_point_light_properties",
      "exposure": "visible",
      "riskLevel": "low",
      "requiresWrite": false,
      "requiresBuild": false,
      "requiresExternalProcess": false,
      "requiresRestart": false,
      "requiresProjectMemory": false,
      "requiresLock": false,
      "dryRunSupport": false,
      "preflightSupport": false,
      "postcheckSupport": false,
      "testCoverage": "missing",
      "owner": "UEvolve Core",
      "docsPath": "README.md#tool-coverage",
      "reason": "Explicit registry: actors tool with controlled write or workflow side effects.",
      "notes": ""
    },
    {
      "name": "unreal.bp_add_branch_node",
      "category": "blueprint",
      "handlerName": "unreal.bp_add_branch_node",
      "exposure": "visible",
      "riskLevel": "medium",
      "requiresWrite": true,
      "requiresBuild": false,
      "requiresExternalProcess": false,
      "requiresRestart": false,
      "requiresProjectMemory": false,
      "requiresLock": false,
      "dryRunSupport": false,
      "preflightSupport": true,
      "postcheckSupport": true,
      "testCoverage": "missing",
      "owner": "UEvolve Core",
      "docsPath": "README.md#tool-coverage",
      "reason": "Explicit registry: blueprint tool with controlled write or workflow side effects.",
      "notes": ""
    },
    {
      "name": "unreal.bp_add_call_function_node",
      "category": "blueprint",
      "handlerName": "unreal.bp_add_call_function_node",
      "exposure": "visible",
      "riskLevel": "medium",
      "requiresWrite": true,
      "requiresBuild": false,
      "requiresExternalProcess": false,
      "requiresRestart": false,
      "requiresProjectMemory": false,
      "requiresLock": false,
      "dryRunSupport": false,
      "preflightSupport": true,
      "postcheckSupport": true,
      "testCoverage": "missing",
      "owner": "UEvolve Core",
      "docsPath": "README.md#tool-coverage",
      "reason": "Explicit registry: blueprint tool with controlled write or workflow side effects.",
      "notes": ""
    },
    {
      "name": "unreal.bp_add_event_node",
      "category": "blueprint",
      "handlerName": "unreal.bp_add_event_node",
      "exposure": "visible",
      "riskLevel": "medium",
      "requiresWrite": true,
      "requiresBuild": false,
      "requiresExternalProcess": false,
      "requiresRestart": false,
      "requiresProjectMemory": false,
      "requiresLock": false,
      "dryRunSupport": false,
      "preflightSupport": true,
      "postcheckSupport": true,
      "testCoverage": "missing",
      "owner": "UEvolve Core",
      "docsPath": "README.md#tool-coverage",
      "reason": "Explicit registry: blueprint tool with controlled write or workflow side effects.",
      "notes": ""
    },
    {
      "name": "unreal.bp_add_for_each_node",
      "category": "blueprint",
      "handlerName": "unreal.bp_add_for_each_node",
      "exposure": "visible",
      "riskLevel": "medium",
      "requiresWrite": true,
      "requiresBuild": false,
      "requiresExternalProcess": false,
      "requiresRestart": false,
      "requiresProjectMemory": false,
      "requiresLock": false,
      "dryRunSupport": false,
      "preflightSupport": true,
      "postcheckSupport": true,
      "testCoverage": "missing",
      "owner": "UEvolve Core",
      "docsPath": "README.md#tool-coverage",
      "reason": "Explicit registry: blueprint tool with controlled write or workflow side effects.",
      "notes": ""
    },
    {
      "name": "unreal.bp_add_function",
      "category": "blueprint",
      "handlerName": "unreal.bp_add_function",
      "exposure": "visible",
      "riskLevel": "medium",
      "requiresWrite": true,
      "requiresBuild": false,
      "requiresExternalProcess": false,
      "requiresRestart": false,
      "requiresProjectMemory": false,
      "requiresLock": false,
      "dryRunSupport": false,
      "preflightSupport": true,
      "postcheckSupport": true,
      "testCoverage": "missing",
      "owner": "UEvolve Core",
      "docsPath": "README.md#tool-coverage",
      "reason": "Explicit registry: blueprint tool with controlled write or workflow side effects.",
      "notes": ""
    },
    {
      "name": "unreal.bp_add_variable",
      "category": "blueprint",
      "handlerName": "unreal.bp_add_variable",
      "exposure": "visible",
      "riskLevel": "medium",
      "requiresWrite": true,
      "requiresBuild": false,
      "requiresExternalProcess": false,
      "requiresRestart": false,
      "requiresProjectMemory": false,
      "requiresLock": false,
      "dryRunSupport": false,
      "preflightSupport": true,
      "postcheckSupport": true,
      "testCoverage": "category",
      "owner": "UEvolve Core",
      "docsPath": "README.md#tool-coverage",
      "reason": "Explicit registry: blueprint tool with controlled write or workflow side effects.",
      "notes": ""
    },
    {
      "name": "unreal.bp_arrange_graph",
      "category": "blueprint",
      "handlerName": "unreal.bp_arrange_graph",
      "exposure": "visible",
      "riskLevel": "medium",
      "requiresWrite": true,
      "requiresBuild": false,
      "requiresExternalProcess": false,
      "requiresRestart": false,
      "requiresProjectMemory": false,
      "requiresLock": false,
      "dryRunSupport": false,
      "preflightSupport": true,
      "postcheckSupport": true,
      "testCoverage": "missing",
      "owner": "UEvolve Core",
      "docsPath": "README.md#tool-coverage",
      "reason": "Explicit registry: blueprint tool with controlled write or workflow side effects.",
      "notes": ""
    },
    {
      "name": "unreal.bp_compile_save",
      "category": "blueprint",
      "handlerName": "unreal.bp_compile_save",
      "exposure": "visible",
      "riskLevel": "medium",
      "requiresWrite": true,
      "requiresBuild": false,
      "requiresExternalProcess": false,
      "requiresRestart": false,
      "requiresProjectMemory": false,
      "requiresLock": false,
      "dryRunSupport": false,
      "preflightSupport": true,
      "postcheckSupport": true,
      "testCoverage": "category",
      "owner": "UEvolve Core",
      "docsPath": "README.md#tool-coverage",
      "reason": "Explicit registry: blueprint tool with controlled write or workflow side effects.",
      "notes": ""
    },
    {
      "name": "unreal.bp_connect_pins",
      "category": "blueprint",
      "handlerName": "unreal.bp_connect_pins",
      "exposure": "visible",
      "riskLevel": "medium",
      "requiresWrite": true,
      "requiresBuild": false,
      "requiresExternalProcess": false,